{
  "analysis_scope": {
    "legacy_gold_read": false,
    "model_ready_read": false,
    "production_feature_config_mutated": false,
    "source_layer": "silver",
    "target_aware_analysis": false
  },
  "decision_capsule": {
    "analysis_exactness": {
      "exactness": "exact",
      "name": "analysis_exactness",
      "value": "exact"
    },
    "blocker_count": {
      "exactness": "exact",
      "name": "blocker_count",
      "unit": "blockers",
      "value": 0
    },
    "candidate_count": {
      "exactness": "exact",
      "name": "candidate_count",
      "unit": "candidates",
      "value": 5
    },
    "disposition": {
      "exactness": "exact",
      "name": "disposition",
      "value": "needs_contract_or_data_fix"
    },
    "finding_count": {
      "exactness": "exact",
      "name": "finding_count",
      "unit": "findings",
      "value": 1
    },
    "pit_status": {
      "exactness": "exact",
      "name": "pit_status",
      "value": {
        "knowledge_semantics": null,
        "temporal_columns": [
          "cocoa_year",
          "latest_release_date"
        ]
      }
    },
    "required_complete_row_rate": {
      "denominator": 15,
      "exactness": "exact",
      "name": "required_complete_row_rate",
      "unit": "fraction",
      "value": 1.0
    },
    "row_count": {
      "exactness": "exact",
      "name": "row_count",
      "unit": "rows",
      "value": 15
    }
  },
  "feature_candidate_generation": {
    "candidate_count": 5,
    "effective_disposition": "needs_contract_or_data_fix",
    "existing_feature_families": [],
    "no_candidate_rationale": null,
    "review_only": true,
    "source_keys": [
      "icco_cocoa"
    ]
  },
  "feature_candidates": [
    {
      "aggregation_window": "one prior observed cocoa season",
      "applicable_commodities": [
        "cocoa"
      ],
      "applicable_geographies": [
        "world"
      ],
      "candidate_id": "eda:silver_icco_cocoa:lagged_grindings_growth",
      "classification": "new",
      "clipping_policy": "None; retain and flag historical extremes.",
      "computation_primitive": "pct_change_then_lag",
      "counter_evidence": [
        "Latest-only hybrid-release history does not prove historical cutoff availability.",
        "Only 15 observed seasons are present, with a three-season gap after 2007/08."
      ],
      "evidence": [
        "metric:distributions.numeric_distributions.grindings_kt",
        "cell:feature-opportunity",
        "cell:pit-leakage"
      ],
      "expected_range": null,
      "feature_family": null,
      "feature_policy": "Review-only; never auto-promote to production feature configuration.",
      "future_target_compatibility": "Eligible only for later PIT-safe evaluation against a new immutable Gold target.",
      "knowledge_time_rule": "Use only the prior season row after proving its source release was available by the prediction cutoff; the current contract does not yet govern that proof.",
      "lag": 1,
      "mechanism": "Lagged grindings growth represents processing-demand momentum.",
      "missingness_policy": "Preserve missing values; do not bridge missing cocoa seasons.",
      "normalization_policy": "None until PIT-safe prototype review.",
      "observation_time_rule": "Parse cocoa_year chronologically; never treat lexicographic order or a missing season as a normal one-year step.",
      "output_grain": "cocoa_year",
      "readiness": "needs_contract_or_data_fix",
      "review_status": "unreviewed",
      "semantic_scope": "World ICCO balance sheet; lagged source-only proposal.",
      "source_columns": [
        "grindings_kt",
        "cocoa_year",
        "latest_release_date"
      ],
      "source_table": "silver_icco_cocoa",
      "transformation": {
        "availability_check": "prior latest_release_date <= prediction cutoff",
        "column": "grindings_kt",
        "gap_policy": "require consecutive cocoa seasons or mark missing",
        "lag_observations": 1,
        "operation": "pct_change_then_lag",
        "order_by": "cocoa_year"
      },
      "unit": "fraction",
      "visibility_class": "review_required"
    },
    {
      "aggregation_window": "one prior observed cocoa season",
      "applicable_commodities": [
        "cocoa"
      ],
      "applicable_geographies": [
        "world"
      ],
      "candidate_id": "eda:silver_icco_cocoa:lagged_production_growth",
      "classification": "new",
      "clipping_policy": "None; retain and flag historical extremes.",
      "computation_primitive": "pct_change_then_lag",
      "counter_evidence": [
        "Latest-only hybrid-release history does not prove historical cutoff availability.",
        "Only 15 observed seasons are present, with a three-season gap after 2007/08."
      ],
      "evidence": [
        "metric:distributions.numeric_distributions.production_kt",
        "cell:feature-opportunity",
        "cell:pit-leakage"
      ],
      "expected_range": null,
      "feature_family": null,
      "feature_policy": "Review-only; never auto-promote to production feature configuration.",
      "future_target_compatibility": "Eligible only for later PIT-safe evaluation against a new immutable Gold target.",
      "knowledge_time_rule": "Use only the prior season row after proving its source release was available by the prediction cutoff; the current contract does not yet govern that proof.",
      "lag": 1,
      "mechanism": "Lagged production growth represents world supply momentum.",
      "missingness_policy": "Preserve missing values; do not bridge missing cocoa seasons.",
      "normalization_policy": "None until PIT-safe prototype review.",
      "observation_time_rule": "Parse cocoa_year chronologically; never treat lexicographic order or a missing season as a normal one-year step.",
      "output_grain": "cocoa_year",
      "readiness": "needs_contract_or_data_fix",
      "review_status": "unreviewed",
      "semantic_scope": "World ICCO balance sheet; lagged source-only proposal.",
      "source_columns": [
        "production_kt",
        "cocoa_year",
        "latest_release_date"
      ],
      "source_table": "silver_icco_cocoa",
      "transformation": {
        "availability_check": "prior latest_release_date <= prediction cutoff",
        "column": "production_kt",
        "gap_policy": "require consecutive cocoa seasons or mark missing",
        "lag_observations": 1,
        "operation": "pct_change_then_lag",
        "order_by": "cocoa_year"
      },
      "unit": "fraction",
      "visibility_class": "review_required"
    },
    {
      "aggregation_window": "one prior observed cocoa season",
      "applicable_commodities": [
        "cocoa"
      ],
      "applicable_geographies": [
        "world"
      ],
      "candidate_id": "eda:silver_icco_cocoa:lagged_stock_change",
      "classification": "new",
      "clipping_policy": "None; retain and flag historical extremes.",
      "computation_primitive": "difference_then_lag",
      "counter_evidence": [
        "Latest-only hybrid-release history does not prove historical cutoff availability.",
        "Only 15 observed seasons are present, with a three-season gap after 2007/08."
      ],
      "evidence": [
        "metric:distributions.numeric_distributions.end_stocks_kt",
        "cell:feature-opportunity",
        "cell:pit-leakage"
      ],
      "expected_range": null,
      "feature_family": null,
      "feature_policy": "Review-only; never auto-promote to production feature configuration.",
      "future_target_compatibility": "Eligible only for later PIT-safe evaluation against a new immutable Gold target.",
      "knowledge_time_rule": "Use only the prior season row after proving its source release was available by the prediction cutoff; the current contract does not yet govern that proof.",
      "lag": 1,
      "mechanism": "Lagged stock change distinguishes inventory rebuilding from drawdown.",
      "missingness_policy": "Preserve missing values; do not bridge missing cocoa seasons.",
      "normalization_policy": "None until PIT-safe prototype review.",
      "observation_time_rule": "Parse cocoa_year chronologically; never treat lexicographic order or a missing season as a normal one-year step.",
      "output_grain": "cocoa_year",
      "readiness": "needs_contract_or_data_fix",
      "review_status": "unreviewed",
      "semantic_scope": "World ICCO balance sheet; lagged source-only proposal.",
      "source_columns": [
        "end_stocks_kt",
        "cocoa_year",
        "latest_release_date"
      ],
      "source_table": "silver_icco_cocoa",
      "transformation": {
        "availability_check": "prior latest_release_date <= prediction cutoff",
        "column": "end_stocks_kt",
        "gap_policy": "require consecutive cocoa seasons or mark missing",
        "lag_observations": 1,
        "operation": "difference_then_lag",
        "order_by": "cocoa_year"
      },
      "unit": "kilotonnes",
      "visibility_class": "review_required"
    },
    {
      "aggregation_window": "one prior observed cocoa season",
      "applicable_commodities": [
        "cocoa"
      ],
      "applicable_geographies": [
        "world"
      ],
      "candidate_id": "eda:silver_icco_cocoa:prior_published_balance",
      "classification": "new",
      "clipping_policy": "None; retain and flag historical extremes.",
      "computation_primitive": "lag",
      "counter_evidence": [
        "Latest-only hybrid-release history does not prove historical cutoff availability.",
        "Only 15 observed seasons are present, with a three-season gap after 2007/08."
      ],
      "evidence": [
        "metric:distributions.numeric_distributions.surplus_deficit_kt",
        "cell:feature-opportunity",
        "cell:pit-leakage"
      ],
      "expected_range": null,
      "feature_family": null,
      "feature_policy": "Review-only; never auto-promote to production feature configuration.",